<?xml version="1.0" encoding="UTF-8"?>
<invoice xmlns="http://www.opentaps.org/module/ws/rest/domain/billing"
    xmlns:xsi="http://www.w3.org/2001/XMLSchema-instance"
    xsi:schemaLocation="http://www.opentaps.org/module/ws/rest/domain/billing file:/Volumes/Work/Code/Git/Clients/souq/opentaps/rest-api/schema/billing.xsd">

    <invoiceTypeId>SALES_INVOICE</invoiceTypeId>
    <status>INVOICE_READY</status>
    <partyIdFrom>Souq_uae</partyIdFrom>
    <partyId>aabdullah</partyId>
    <currencyUomId>AED</currencyUomId>
    <invoiceDate>2011-10-05T19:15:00</invoiceDate>
    <description>test invoice</description>
    <invoiceItems>
        <invoiceItemSeqId></invoiceItemSeqId>
        <productId></productId>
        <quantity></quantity>
        <amount></amount>
        <description></description>
    </invoiceItems>
    <payment>
        <paymentId></paymentId>
    </payment>
    <payment>
        <paymentId></paymentId>
    </payment>

</invoice>